[
  {
    "id": "e0000001-0000-4000-8000-000000000001",
    "siteId": "11111111-1111-4111-8111-111111111111",
    "operationId": "40000001-0000-4000-8000-000000000001",
    "code": "FT-2026-001",
    "title": "Fiche remplissage",
    "status": "submitted",
    "assigneeId": "bbbbbbbb-bbbb-4bbb-8bbb-bbbbbbbbbbbb",
    "dueAt": "2026-05-02T08:00:00.000Z",
    "checklist": [
      {
        "id": "safety",
        "label": "EPI controles",
        "required": true,
        "checked": true
      },
      {
        "id": "measure",
        "label": "Mesure saisie",
        "required": true,
        "checked": true
      }
    ],
    "requiredFields": [
      "temperatureC",
      "density"
    ],
    "createdAt": "2026-05-18T09:00:00.000Z",
    "updatedAt": "2026-05-18T09:00:00.000Z"
  },
  {
    "id": "e0000002-0000-4000-8000-000000000002",
    "siteId": "11111111-1111-4111-8111-111111111111",
    "operationId": "40000002-0000-4000-8000-000000000002",
    "code": "FT-2026-002",
    "title": "Fiche prise_densite_temperature",
    "status": "submitted",
    "assigneeId": "bbbbbbbb-bbbb-4bbb-8bbb-bbbbbbbbbbbb",
    "dueAt": "2026-05-03T08:00:00.000Z",
    "checklist": [
      {
        "id": "safety",
        "label": "EPI controles",
        "required": true,
        "checked": true
      },
      {
        "id": "measure",
        "label": "Mesure saisie",
        "required": true,
        "checked": true
      }
    ],
    "requiredFields": [
      "temperatureC",
      "density"
    ],
    "createdAt": "2026-05-18T09:00:00.000Z",
    "updatedAt": "2026-05-18T09:00:00.000Z"
  },
  {
    "id": "e0000003-0000-4000-8000-000000000003",
    "siteId": "11111111-1111-4111-8111-111111111111",
    "operationId": "40000003-0000-4000-8000-000000000003",
    "code": "FT-2026-003",
    "title": "Fiche soutirage",
    "status": "done",
    "assigneeId": "eeeeeeee-eeee-4eee-8eee-eeeeeeeeeeee",
    "dueAt": "2026-05-04T08:00:00.000Z",
    "checklist": [
      {
        "id": "safety",
        "label": "EPI controles",
        "required": true,
        "checked": true
      },
      {
        "id": "measure",
        "label": "Mesure saisie",
        "required": true,
        "checked": true
      }
    ],
    "requiredFields": [
      "temperatureC",
      "density"
    ],
    "createdAt": "2026-05-18T09:00:00.000Z",
    "updatedAt": "2026-05-18T09:00:00.000Z"
  },
  {
    "id": "e0000004-0000-4000-8000-000000000004",
    "siteId": "11111111-1111-4111-8111-111111111111",
    "operationId": "40000004-0000-4000-8000-000000000004",
    "code": "FT-2026-004",
    "title": "Fiche nettoyage",
    "status": "submitted",
    "assigneeId": "bbbbbbbb-bbbb-4bbb-8bbb-bbbbbbbbbbbb",
    "dueAt": "2026-05-05T08:00:00.000Z",
    "checklist": [
      {
        "id": "safety",
        "label": "EPI controles",
        "required": true,
        "checked": true
      },
      {
        "id": "measure",
        "label": "Mesure saisie",
        "required": true,
        "checked": true
      }
    ],
    "requiredFields": [
      "temperatureC",
      "density"
    ],
    "createdAt": "2026-05-18T09:00:00.000Z",
    "updatedAt": "2026-05-18T09:00:00.000Z"
  },
  {
    "id": "e0000005-0000-4000-8000-000000000005",
    "siteId": "11111111-1111-4111-8111-111111111111",
    "operationId": "40000005-0000-4000-8000-000000000005",
    "code": "FT-2026-005",
    "title": "Fiche reception",
    "status": "submitted",
    "assigneeId": "bbbbbbbb-bbbb-4bbb-8bbb-bbbbbbbbbbbb",
    "dueAt": "2026-05-06T08:00:00.000Z",
    "checklist": [
      {
        "id": "safety",
        "label": "EPI controles",
        "required": true,
        "checked": true
      },
      {
        "id": "measure",
        "label": "Mesure saisie",
        "required": true,
        "checked": true
      }
    ],
    "requiredFields": [
      "temperatureC",
      "density"
    ],
    "createdAt": "2026-05-18T09:00:00.000Z",
    "updatedAt": "2026-05-18T09:00:00.000Z"
  },
  {
    "id": "e0000006-0000-4000-8000-000000000006",
    "siteId": "11111111-1111-4111-8111-111111111111",
    "operationId": "40000006-0000-4000-8000-000000000006",
    "code": "FT-2026-006",
    "title": "Fiche remplissage",
    "status": "submitted",
    "assigneeId": "eeeeeeee-eeee-4eee-8eee-eeeeeeeeeeee",
    "dueAt": "2026-05-07T08:00:00.000Z",
    "checklist": [
      {
        "id": "safety",
        "label": "EPI controles",
        "required": true,
        "checked": true
      },
      {
        "id": "measure",
        "label": "Mesure saisie",
        "required": true,
        "checked": true
      }
    ],
    "requiredFields": [
      "temperatureC",
      "density"
    ],
    "createdAt": "2026-05-18T09:00:00.000Z",
    "updatedAt": "2026-05-18T09:00:00.000Z"
  },
  {
    "id": "e0000007-0000-4000-8000-000000000007",
    "siteId": "11111111-1111-4111-8111-111111111111",
    "operationId": "40000007-0000-4000-8000-000000000007",
    "code": "FT-2026-007",
    "title": "Fiche prise_densite_temperature",
    "status": "done",
    "assigneeId": "bbbbbbbb-bbbb-4bbb-8bbb-bbbbbbbbbbbb",
    "dueAt": "2026-05-08T08:00:00.000Z",
    "checklist": [
      {
        "id": "safety",
        "label": "EPI controles",
        "required": true,
        "checked": true
      },
      {
        "id": "measure",
        "label": "Mesure saisie",
        "required": true,
        "checked": false
      }
    ],
    "requiredFields": [
      "temperatureC",
      "density"
    ],
    "createdAt": "2026-05-18T09:00:00.000Z",
    "updatedAt": "2026-05-18T09:00:00.000Z"
  },
  {
    "id": "e0000008-0000-4000-8000-000000000008",
    "siteId": "11111111-1111-4111-8111-111111111111",
    "operationId": "40000008-0000-4000-8000-000000000008",
    "code": "FT-2026-008",
    "title": "Fiche soutirage",
    "status": "submitted",
    "assigneeId": "bbbbbbbb-bbbb-4bbb-8bbb-bbbbbbbbbbbb",
    "dueAt": "2026-05-09T08:00:00.000Z",
    "checklist": [
      {
        "id": "safety",
        "label": "EPI controles",
        "required": true,
        "checked": true
      },
      {
        "id": "measure",
        "label": "Mesure saisie",
        "required": true,
        "checked": true
      }
    ],
    "requiredFields": [
      "temperatureC",
      "density"
    ],
    "createdAt": "2026-05-18T09:00:00.000Z",
    "updatedAt": "2026-05-18T09:00:00.000Z"
  },
  {
    "id": "e0000009-0000-4000-8000-000000000009",
    "siteId": "11111111-1111-4111-8111-111111111111",
    "operationId": "40000009-0000-4000-8000-000000000009",
    "code": "FT-2026-009",
    "title": "Fiche nettoyage",
    "status": "submitted",
    "assigneeId": "eeeeeeee-eeee-4eee-8eee-eeeeeeeeeeee",
    "dueAt": "2026-05-10T08:00:00.000Z",
    "checklist": [
      {
        "id": "safety",
        "label": "EPI controles",
        "required": true,
        "checked": true
      },
      {
        "id": "measure",
        "label": "Mesure saisie",
        "required": true,
        "checked": true
      }
    ],
    "requiredFields": [
      "temperatureC",
      "density"
    ],
    "createdAt": "2026-05-18T09:00:00.000Z",
    "updatedAt": "2026-05-18T09:00:00.000Z"
  },
  {
    "id": "e0000010-0000-4000-8000-000000000010",
    "siteId": "11111111-1111-4111-8111-111111111111",
    "operationId": "40000010-0000-4000-8000-000000000010",
    "code": "FT-2026-010",
    "title": "Fiche reception",
    "status": "submitted",
    "assigneeId": "bbbbbbbb-bbbb-4bbb-8bbb-bbbbbbbbbbbb",
    "dueAt": "2026-05-11T08:00:00.000Z",
    "checklist": [
      {
        "id": "safety",
        "label": "EPI controles",
        "required": true,
        "checked": true
      },
      {
        "id": "measure",
        "label": "Mesure saisie",
        "required": true,
        "checked": true
      }
    ],
    "requiredFields": [
      "temperatureC",
      "density"
    ],
    "createdAt": "2026-05-18T09:00:00.000Z",
    "updatedAt": "2026-05-18T09:00:00.000Z"
  },
  {
    "id": "e0000011-0000-4000-8000-000000000011",
    "siteId": "11111111-1111-4111-8111-111111111111",
    "operationId": "40000011-0000-4000-8000-000000000011",
    "code": "FT-2026-011",
    "title": "Fiche remplissage",
    "status": "done",
    "assigneeId": "bbbbbbbb-bbbb-4bbb-8bbb-bbbbbbbbbbbb",
    "dueAt": "2026-05-12T08:00:00.000Z",
    "checklist": [
      {
        "id": "safety",
        "label": "EPI controles",
        "required": true,
        "checked": true
      },
      {
        "id": "measure",
        "label": "Mesure saisie",
        "required": true,
        "checked": true
      }
    ],
    "requiredFields": [
      "temperatureC",
      "density"
    ],
    "createdAt": "2026-05-18T09:00:00.000Z",
    "updatedAt": "2026-05-18T09:00:00.000Z"
  },
  {
    "id": "e0000012-0000-4000-8000-000000000012",
    "siteId": "11111111-1111-4111-8111-111111111111",
    "operationId": "40000012-0000-4000-8000-000000000012",
    "code": "FT-2026-012",
    "title": "Fiche prise_densite_temperature",
    "status": "submitted",
    "assigneeId": "eeeeeeee-eeee-4eee-8eee-eeeeeeeeeeee",
    "dueAt": "2026-05-13T08:00:00.000Z",
    "checklist": [
      {
        "id": "safety",
        "label": "EPI controles",
        "required": true,
        "checked": true
      },
      {
        "id": "measure",
        "label": "Mesure saisie",
        "required": true,
        "checked": true
      }
    ],
    "requiredFields": [
      "temperatureC",
      "density"
    ],
    "createdAt": "2026-05-18T09:00:00.000Z",
    "updatedAt": "2026-05-18T09:00:00.000Z"
  }
]
