[
  {
    "id": "17171717-1717-4171-8171-171717171717",
    "siteId": "11111111-1111-4111-8111-111111111111",
    "operationId": "14141414-1414-4141-8141-141414141414",
    "code": "FT-2026-032",
    "title": "Controle fermentation C-01",
    "status": "submitted",
    "assigneeId": "bbbbbbbb-bbbb-4bbb-8bbb-bbbbbbbbbbbb",
    "dueAt": "2026-05-18T12:00:00.000Z",
    "checklist": [
      { "id": "density", "label": "Densite saisie", "required": true, "checked": true },
      { "id": "temp", "label": "Temperature saisie", "required": true, "checked": true }
    ],
    "requiredFields": ["density", "temperatureC"],
    "createdAt": "2026-05-18T09:00:00.000Z",
    "updatedAt": "2026-05-18T09:00:00.000Z"
  }
]
